<?xml version="1.0" encoding="UTF-8"?>
<PedidoCompra xmlns:xsi="http://www.w3.org/2001/XMLSchema-instance" xsi:noNamespaceSchemaLocation="pedidos.xsd">
    <Cliente nombre="Juan Perez" email="juanperez@gmail.com" telefono="123456789">
        <Direccion>
            <calle>Blas Infante</calle>
            <ciudad>Madrid</ciudad>
            <codigoPostal>28080</codigoPostal>
        </Direccion>
    </Cliente>
    <Productos>
        <Producto codigo="123" cantidad="2">
            <Detalles>Libro de Programaci√≥n - Autor: John Doe</Detalles>
        </Producto>
        <Producto codigo="456" cantidad="1">
            <Detalles>Manual de Uso - Autor: Jane Smith</Detalles>
        </Producto>
    </Productos>
    <Total>500</Total>
</PedidoCompra>